{
  "$schema": "https://json-schema.org/draft/2020-12/schema",
  "$id": "https://acidslide.dev/schemas/schema-root-map.schema.json",
  "title": "AcidSlide OOXML Content-Type and Root Mapping",
  "type": "object",
  "additionalProperties": false,
  "required": ["schema_version", "mapping_id", "relevant_part_globs", "excluded_part_globs", "entries"],
  "properties": {
    "schema_version": { "const": "1.0" },
    "mapping_id": { "const": "acidslide-schema-root-map-v1" },
    "relevant_part_globs": {
      "type": "array",
      "minItems": 1,
      "uniqueItems": true,
      "items": { "type": "string", "minLength": 1 }
    },
    "excluded_part_globs": {
      "type": "array",
      "uniqueItems": true,
      "items": { "type": "string", "minLength": 1 }
    },
    "entries": {
      "type": "array",
      "minItems": 1,
      "items": {
        "type": "object",
        "additionalProperties": false,
        "required": ["content_type", "root_qname", "xsd"],
        "properties": {
          "content_type": { "type": "string", "pattern": "^[^/]+/[^/]+$" },
          "root_qname": { "type": "string", "pattern": "^\\{https?://[^}]+\\}[^{}]+$" },
          "xsd": { "type": "string", "pattern": "^[A-Za-z0-9._-]+\\.xsd$" }
        }
      }
    }
  }
}
